<?xml version="1.0" encoding="UTF-8" ?>
<ruleset xmlns:xsi="http://www.w3.org/2001/XMLSchema-instance"
         xsi:noNamespaceSchemaLocation="https://raw.githubusercontent.com/commercetools/rmf-codegen/main/ctp-validators/src/main/resources/ruleset.xsd">
    <name>default</name>
    <apply set="default"/>
    <rules>
        <rule enabled="false">
            <name>com.commercetools.rmf.validators.DatetimeRule</name>
        </rule>
        <rule enabled="true">
            <name>com.commercetools.rmf.validators.BooleanPropertyNameRule</name>
        </rule>
    </rules>
</ruleset>
